{
  "$schema": "https://json-schema.org/draft/2020-12/schema",
  "$id": "urn:abalo:sites-meihua:v1:response",
  "title": "Sites Meihua Response V1",
  "type": "object",
  "additionalProperties": false,
  "required": ["contract_version", "request_id", "status", "deterministic_result", "narrative", "release_gate", "audit", "errors"],
  "properties": {
    "contract_version": {"const": "SITES_MEIHUA_API_CONTRACT_V1"},
    "request_id": {"$ref": "#/$defs/public_request_id"},
    "status": {"enum": ["SUCCESS", "VALIDATION_ERROR", "ENGINE_ERROR", "RELEASE_BLOCKED"]},
    "question_text": {"type": "string", "minLength": 1, "maxLength": 500},
    "deterministic_result": {"oneOf": [{"$ref": "#/$defs/deterministic_result"}, {"type": "null"}]},
    "narrative": {"$ref": "#/$defs/narrative"},
    "release_gate": {"$ref": "#/$defs/release_gate"},
    "audit": {"$ref": "#/$defs/audit"},
    "errors": {"type": "array", "items": {"$ref": "#/$defs/error"}}
  },
  "allOf": [
    {"if": {"properties": {"status": {"const": "SUCCESS"}}, "required": ["status"]}, "then": {"required": ["question_text"], "properties": {"deterministic_result": {"$ref": "#/$defs/deterministic_result"}, "errors": {"maxItems": 0}}}},
    {"if": {"properties": {"status": {"enum": ["VALIDATION_ERROR", "ENGINE_ERROR"]}}, "required": ["status"]}, "then": {"properties": {"deterministic_result": {"type": "null"}, "errors": {"minItems": 1}}}},
    {"if": {"properties": {"status": {"const": "RELEASE_BLOCKED"}}, "required": ["status"]}, "then": {"properties": {"errors": {"minItems": 1}}}}
  ],
  "$defs": {
    "hexagram": {"type": "object", "additionalProperties": false, "required": ["king_wen_number", "name", "symbol"], "properties": {"king_wen_number": {"type": "integer", "minimum": 1, "maximum": 64}, "name": {"type": "string", "minLength": 1}, "symbol": {"type": "string", "minLength": 1}}},
    "body_use": {"type": "object", "additionalProperties": false, "required": ["body_trigram", "initial_use_trigram", "changed_use_trigram", "initial_relation", "changed_relation"], "properties": {"body_trigram": {"type": "string", "minLength": 1}, "initial_use_trigram": {"type": "string", "minLength": 1}, "changed_use_trigram": {"type": "string", "minLength": 1}, "initial_relation": {"$ref": "#/$defs/body_use_relation"}, "changed_relation": {"$ref": "#/$defs/body_use_relation"}}},
    "body_use_relation": {"enum": ["USE_GENERATES_BODY", "BODY_CONTROLS_USE", "SAME_ELEMENT", "BODY_GENERATES_USE", "USE_CONTROLS_BODY"]},
    "five_elements": {"type": "object", "additionalProperties": false, "required": ["body", "initial_use", "changed_use"], "properties": {"body": {"type": "string", "minLength": 1}, "initial_use": {"type": "string", "minLength": 1}, "changed_use": {"type": "string", "minLength": 1}}},
    "seasonal_strength": {"type": "object", "additionalProperties": false, "required": ["body", "initial_use", "changed_use", "solar_term", "month_branch"], "properties": {"body": {"$ref": "#/$defs/strength"}, "initial_use": {"$ref": "#/$defs/strength"}, "changed_use": {"$ref": "#/$defs/strength"}, "solar_term": {"type": "string", "minLength": 1}, "month_branch": {"type": "string", "minLength": 1}}},
    "strength": {"enum": ["PROSPEROUS", "SUPPORTED", "RESTING", "CONFINED", "DEAD"]},
    "relation_assessment": {"type": "object", "additionalProperties": false, "required": ["phase", "relation", "direction", "strength", "body_strength", "use_strength", "modifier_rule_ids", "evidence_ids", "conditions", "warnings"], "properties": {"phase": {"enum": ["INITIAL", "CHANGED"]}, "relation": {"$ref": "#/$defs/body_use_relation"}, "direction": {"enum": ["FAVORABLE", "MIXED", "UNFAVORABLE"]}, "strength": {"enum": ["STRONG", "MEDIUM", "WEAK"]}, "body_strength": {"$ref": "#/$defs/strength"}, "use_strength": {"$ref": "#/$defs/strength"}, "modifier_rule_ids": {"type": "array", "items": {"type": "string"}}, "evidence_ids": {"type": "array", "minItems": 1, "items": {"type": "string", "minLength": 1}}, "conditions": {"type": "array", "items": {"type": "string"}}, "warnings": {"type": "array", "items": {"type": "string"}}}},
    "deterministic_conclusion": {"type": "object", "additionalProperties": false, "required": ["conclusion_level", "evidence_sufficiency", "supporting_evidence_ids", "blocking_evidence_ids", "conflicting_evidence_ids", "required_conditions", "synthesis_rule_ids", "warnings", "relation_assessments"], "properties": {"conclusion_level": {"enum": ["CLEARLY_FAVORABLE", "CONDITIONALLY_FAVORABLE", "MIXED_OR_UNSETTLED", "CLEARLY_UNFAVORABLE", "INSUFFICIENT_EVIDENCE"]}, "evidence_sufficiency": {"enum": ["SUFFICIENT", "LIMITED", "INSUFFICIENT"]}, "supporting_evidence_ids": {"type": "array", "items": {"type": "string"}}, "blocking_evidence_ids": {"type": "array", "items": {"type": "string"}}, "conflicting_evidence_ids": {"type": "array", "items": {"type": "string"}}, "required_conditions": {"type": "array", "items": {"type": "string"}}, "synthesis_rule_ids": {"type": "array", "items": {"type": "string"}}, "warnings": {"type": "array", "items": {"type": "string"}}, "relation_assessments": {"type": "array", "items": {"$ref": "#/$defs/relation_assessment"}}}},
    "evidence_summary": {"type": "object", "additionalProperties": false, "required": ["count", "evidence_types", "knowledge_mode", "approved_knowledge_items_used"], "properties": {"count": {"type": "integer", "minimum": 0}, "evidence_types": {"type": "array", "uniqueItems": true, "items": {"type": "string", "minLength": 1}}, "knowledge_mode": {"enum": ["PRODUCTION", "INTERNAL_REVIEW", "INTERNAL_DRAFT_PREVIEW"]}, "approved_knowledge_items_used": {"type": "integer", "minimum": 0}}},
    "narrative": {"type": "object", "additionalProperties": false, "required": ["status", "available", "content", "blocked_reason", "live_validation_status"], "properties": {"status": {"const": "UNVERIFIED"}, "available": {"const": false}, "content": {"type": "null"}, "blocked_reason": {"type": "string", "minLength": 1}, "live_validation_status": {"const": "BLOCKED_BY_EXECUTION_POLICY"}}},
    "release_gate": {"type": "object", "additionalProperties": false, "required": ["should_charge", "formal_report_persistence_allowed", "closed_beta_allowed", "narrative_release_status"], "properties": {"should_charge": {"const": false}, "formal_report_persistence_allowed": {"const": false}, "closed_beta_allowed": {"const": false}, "narrative_release_status": {"const": "UNVERIFIED"}}},
    "audit": {"type": "object", "additionalProperties": false, "required": ["engine_version", "contract_version", "calculation_source", "generated_at", "synthetic_or_real_input", "request_hash", "audit_id"], "properties": {"engine_version": {"type": ["string", "null"]}, "contract_version": {"const": "SITES_MEIHUA_API_CONTRACT_V1"}, "calculation_source": {"const": "PYTHON_AUTHORITATIVE_ENGINE"}, "generated_at": {"type": "string", "format": "date-time", "pattern": "^\\d{4}-\\d{2}-\\d{2}T\\d{2}:\\d{2}:\\d{2}(?:\\.\\d+)?(?:Z|[+-]\\d{2}:\\d{2})$"}, "client_timestamp": {"type": "string", "format": "date-time", "pattern": "^\\d{4}-\\d{2}-\\d{2}T\\d{2}:\\d{2}:\\d{2}(?:\\.\\d+)?(?:Z|[+-]\\d{2}:\\d{2})$"}, "client_timestamp_used_for_calculation": {"const": false}, "synthetic_or_real_input": {"enum": ["SYNTHETIC", "REAL", "UNSPECIFIED"]}, "request_hash": {"oneOf": [{"type": "string", "pattern": "^[a-f0-9]{64}$"}, {"type": "null"}]}, "audit_id": {"type": "string", "pattern": "^audit-[a-f0-9]{16}$"}}},
    "public_request_id": {"type": "string", "minLength": 1, "maxLength": 128, "anyOf": [{"const": "invalid-request"}, {"pattern": "^[A-Za-z0-9][A-Za-z0-9._:-]{0,127}$"}]},
    "error": {"type": "object", "additionalProperties": false, "required": ["error_code", "message", "request_id", "audit_id"], "properties": {"error_code": {"enum": ["INVALID_REQUEST", "EMPTY_QUESTION", "INVALID_NUMBER_COUNT", "INVALID_NUMBER_TYPE", "MULTIPLE_QUESTIONS_NOT_ALLOWED", "CLIENT_CALCULATION_NOT_ACCEPTED", "ENGINE_ERROR", "NARRATIVE_UNVERIFIED", "FORMAL_PERSISTENCE_BLOCKED", "CHARGING_BLOCKED", "CLOSED_BETA_BLOCKED"]}, "message": {"type": "string", "minLength": 1}, "request_id": {"type": "string", "minLength": 1, "maxLength": 128, "anyOf": [{"const": "invalid-request"}, {"pattern": "^[A-Za-z0-9][A-Za-z0-9._:-]{0,127}$"}]}, "audit_id": {"type": "string", "pattern": "^audit-[a-f0-9]{16}$"}}},
    "deterministic_result": {"type": "object", "additionalProperties": false, "required": ["input_numbers", "base_hexagram", "mutual_hexagram", "changed_hexagram", "moving_line", "body_use", "five_elements", "seasonal_strength", "deterministic_conclusion", "evidence_summary"], "properties": {"input_numbers": {"type": "array", "minItems": 3, "maxItems": 3, "items": {"type": "integer", "minimum": 1, "maximum": 999}}, "base_hexagram": {"$ref": "#/$defs/hexagram"}, "mutual_hexagram": {"$ref": "#/$defs/hexagram"}, "changed_hexagram": {"$ref": "#/$defs/hexagram"}, "moving_line": {"type": "integer", "minimum": 1, "maximum": 6}, "body_use": {"$ref": "#/$defs/body_use"}, "five_elements": {"$ref": "#/$defs/five_elements"}, "seasonal_strength": {"$ref": "#/$defs/seasonal_strength"}, "deterministic_conclusion": {"$ref": "#/$defs/deterministic_conclusion"}, "evidence_summary": {"$ref": "#/$defs/evidence_summary"}}}
  }
}
