{
  "contract_version": "SITES_MEIHUA_API_CONTRACT_V1",
  "request_id": "phase3a-release-blocked-001",
  "status": "RELEASE_BLOCKED",
  "deterministic_result": null,
  "narrative": {"status": "UNVERIFIED", "available": false, "content": null, "blocked_reason": "解释功能尚未完成真实路径验证", "live_validation_status": "BLOCKED_BY_EXECUTION_POLICY"},
  "release_gate": {"should_charge": false, "formal_report_persistence_allowed": false, "closed_beta_allowed": false, "narrative_release_status": "UNVERIFIED"},
  "audit": {"engine_version": null, "contract_version": "SITES_MEIHUA_API_CONTRACT_V1", "calculation_source": "PYTHON_AUTHORITATIVE_ENGINE", "generated_at": "2026-07-13T10:00:00+08:00", "synthetic_or_real_input": "SYNTHETIC", "request_hash": null, "audit_id": "audit-0000000000000000"},
  "errors": [
    {"error_code": "NARRATIVE_UNVERIFIED", "message": "AI解释尚未完成实时验证。", "request_id": "phase3a-release-blocked-001", "audit_id": "audit-0000000000000000"},
    {"error_code": "FORMAL_PERSISTENCE_BLOCKED", "message": "当前不允许正式保存AI Narrative。", "request_id": "phase3a-release-blocked-001", "audit_id": "audit-0000000000000000"},
    {"error_code": "CHARGING_BLOCKED", "message": "当前不允许收费。", "request_id": "phase3a-release-blocked-001", "audit_id": "audit-0000000000000000"},
    {"error_code": "CLOSED_BETA_BLOCKED", "message": "当前不允许进入封闭测试。", "request_id": "phase3a-release-blocked-001", "audit_id": "audit-0000000000000000"}
  ]
}
