{
  "contract_version": "SITES_MEIHUA_API_CONTRACT_V1",
  "request_id": "phase3a-synthetic-demo-001",
  "status": "SUCCESS",
  "question_text": "我应该如何更稳妥地推进当前合作？",
  "deterministic_result": {
    "input_numbers": [100, 27, 368],
    "base_hexagram": {"king_wen_number": 55, "name": "雷火丰", "symbol": "䷶"},
    "mutual_hexagram": {"king_wen_number": 28, "name": "泽风大过", "symbol": "䷛"},
    "changed_hexagram": {"king_wen_number": 34, "name": "雷天大壮", "symbol": "䷡"},
    "moving_line": 2,
    "body_use": {"body_trigram": "震", "initial_use_trigram": "离", "changed_use_trigram": "乾", "initial_relation": "BODY_GENERATES_USE", "changed_relation": "USE_CONTROLS_BODY"},
    "five_elements": {"body": "木", "initial_use": "火", "changed_use": "金"},
    "seasonal_strength": {"body": "CONFINED", "initial_use": "RESTING", "changed_use": "SUPPORTED", "solar_term": "小暑", "month_branch": "未"},
    "deterministic_conclusion": {"conclusion_level": "CLEARLY_UNFAVORABLE", "evidence_sufficiency": "SUFFICIENT", "supporting_evidence_ids": [], "blocking_evidence_ids": ["E02", "E03"], "conflicting_evidence_ids": [], "required_conditions": [], "synthesis_rule_ids": ["MEIHUA-V2A-BOTH-UNFAVORABLE-CLEAR"], "warnings": [], "relation_assessments": []},
    "evidence_summary": {"count": 9, "evidence_types": ["BASE_HEXAGRAM", "INITIAL_BODY_USE_RELATION", "CHANGED_BODY_USE_RELATION"], "knowledge_mode": "PRODUCTION", "approved_knowledge_items_used": 0}
  },
  "narrative": {"status": "UNVERIFIED", "available": false, "content": null, "blocked_reason": "解释功能尚未完成真实路径验证", "live_validation_status": "BLOCKED_BY_EXECUTION_POLICY"},
  "release_gate": {"should_charge": false, "formal_report_persistence_allowed": false, "closed_beta_allowed": false, "narrative_release_status": "UNVERIFIED"},
  "audit": {"engine_version": "MEIHUA_ENGINE_PHASE1_V1", "contract_version": "SITES_MEIHUA_API_CONTRACT_V1", "calculation_source": "PYTHON_AUTHORITATIVE_ENGINE", "generated_at": "2026-07-13T10:30:00+08:00", "client_timestamp": "2026-07-13T10:00:00+08:00", "client_timestamp_used_for_calculation": false, "synthetic_or_real_input": "SYNTHETIC", "request_hash": "c768d97d1edd15ffa2dcbc3a15fe216cbfd8ca30c5f3c6795155d6b3aae0df32", "audit_id": "audit-bee55d67a95299fe"},
  "errors": []
}
